msg_id,user_id,content,timestamp,label,hate_speech,gambling,severity
1,5,"Lige ramt scatter 3 gange i træk på forskellige spil, er det et tegn? 😂",2026-04-13 12:00:00,normal,False,False,none
2,14,okay jeg sætter bare de her 2000 ind. hvis jeg taber dem er det FÆRDIG. det lover jeg mig selv,2026-04-13 12:02:00,gambling,False,True,high
3,77,Hej! Nogen der kan anbefale et godt slot under 1kr pr spin?,2026-04-13 12:04:00,normal,False,False,none
4,56,"Fik en x847 win på Mental forleden, stadig ikke over det 😂",2026-04-13 12:06:00,normal,False,False,none
5,45,Er der nogen der ved om der kommer nye spil i weekenden?,2026-04-13 12:08:00,normal,False,False,none
6,41,Hej er der nogen danske spillere her eller er det mest udlændinge?,2026-04-13 12:10:00,normal,False,False,none
7,56,"tredje indskud denne uge, det er lidt meget men det går nok",2026-04-13 12:12:00,gambling,False,True,low
8,78,"kan i ikke bare fikse de her lags, det koster mig penge ffs",2026-04-13 12:14:00,hate_speech,True,False,low
9,66,Bonuskøb værd eller ej? Tænker på at prøve på Dog House,2026-04-13 12:16:00,normal,False,False,none
10,15,"okay sidst for i aften, det siger jeg altid men denne gang mener jeg det... måske",2026-04-13 12:18:00,gambling,False,True,low
11,50,"Blackjack bordet er mega lækkert i dag, dealer er varm på hånden haha",2026-04-13 12:20:00,both,True,True,medium
12,74,"Har spillet her i 2 år nu og det er stadig mit yndlings casino, aldrig haft problemer",2026-04-13 12:22:00,both,True,True,medium
13,25,"prøver pragmatic play slots for første gang, tips?",2026-04-13 12:24:00,normal,False,False,none
14,33,øv øv øv... taber hver gang jeg spiller høj indsats,2026-04-13 12:26:00,hate_speech,True,False,low
15,6,er der nogen der ved hvornår der kommer nye slots? spørger for en ven,2026-04-13 12:28:00,edge_case,,,ambiguous
16,56,Nogen der spiller live blackjack? Dealer er vist sur på mig i dag lol,2026-04-13 12:30:00,normal,False,False,none
17,1,SKAL VINDE TILBAGE NU. sætter alt ind på rød. ALT,2026-04-13 12:32:00,gambling,False,True,high
18,67,Kan nogen forklare mig hvordan megaways egentlig virker? Er lidt forvirret,2026-04-13 12:34:00,normal,False,False,none
19,69,"sikke noget møg, dealer får blackjack IGEN",2026-04-13 12:36:00,hate_speech,True,False,low
20,26,dit spil er ligeså ulækkert som du sikkert ser ud i virkeligheden,2026-04-13 12:38:00,hate_speech,True,False,medium
21,47,"Fik endelig min bonus udbetalt efter at have mødt wageringen, took forever",2026-04-13 12:40:00,both,True,True,medium
22,56,okay nu stopper jeg bare efter dette spin... det har jeg sagt 40 gange nu,2026-04-13 12:42:00,gambling,False,True,low
23,9,"kæft hvor er du en ulækker lille orm, forpest ikke chatten med din tilstedeværelse",2026-04-13 12:44:00,hate_speech,True,False,high
24,43,min mor spurgte hvorfor jeg virker så stresset. sagde det var arbejde. det er ikke arbejde,2026-04-13 12:46:00,gambling,False,True,high
25,80,"Kundeservice her er faktisk ret god, fik løst mit problem på 10 min",2026-04-13 12:48:00,normal,False,False,none
26,41,"det her er jo ikke gambling, det er bare underholdning ikk 😅",2026-04-13 12:50:00,edge_case,,,ambiguous
27,16,kan du ikke bare forsvinde? du irriterer alle andre ved bordet med dit fjollede snak,2026-04-13 12:52:00,hate_speech,True,False,medium
28,39,"Nå okay, så taber man bare 200 kr på 5 minutter. Fantastisk 🙄",2026-04-13 12:54:00,hate_speech,True,False,low
29,65,din mor burde have slugt dig din lille lort,2026-04-13 12:56:00,hate_speech,True,False,medium
30,40,jeg ved godt det er tilfældigt men det virker sgu ikke sådan,2026-04-13 12:58:00,hate_speech,True,False,low
31,53,"Blackjack dealer er så heldig i dag, har tabt 4 gange i træk 😩",2026-04-13 13:00:00,normal,False,False,none
32,42,"Har siddet her i 2 timer og breakeven, det er bedre end normalt tbh",2026-04-13 13:02:00,normal,False,False,none
33,52,"øv mand, lige netop ikke nok til bonusrunden 😒",2026-04-13 13:04:00,hate_speech,True,False,low
34,38,Hvad er omsætningskravene på den nye bonus? Syntes det stod 35x?,2026-04-13 13:06:00,normal,False,False,none
35,71,fucking perkersvin gå hjem til dit eget land,2026-04-13 13:08:00,hate_speech,True,False,high
36,17,"Spiller altid med lille indsats, varer længere og er mere sjovt synes jeg",2026-04-13 13:10:00,normal,False,False,none
37,25,"Prøv Gates of Olympus på maks bet, det er SÅ fedt når det rammer",2026-04-13 13:12:00,both,True,True,medium
38,54,"Tak for welkomstbonus den var sgu fed, 200% match er ikke dårligt",2026-04-13 13:14:00,normal,False,False,none
39,49,"Hold da op hvor er det irriterende, alle andre vinder og jeg sidder her som en idiot",2026-04-13 13:16:00,hate_speech,True,False,low
40,23,Lige hjemme fra arbejde og klar til at smide nogle spins 🎰,2026-04-13 13:18:00,normal,False,False,none
41,79,"har ikke sovet i 2 dage, sidder bare og spiller hele tiden, kan ikke stoppe selvom jeg ved jeg burde",2026-04-13 13:20:00,gambling,False,True,high
42,73,"hold da op med det lort, free spins giver altid 0",2026-04-13 13:22:00,hate_speech,True,False,low
43,39,"GG til dem der vandt på turneringen i går, jeg røg ud i første runde lol",2026-04-13 13:24:00,normal,False,False,none
44,52,"hej alle sammen, første gang jeg er her",2026-04-13 13:26:00,normal,False,False,none
45,71,"til jer der siger jeg skal stoppe: I FORSTÅR DET IKKE. Jeg er ikke afhængig, jeg har bare haft en dårlig uge. Næste spin er anderledes det kan jeg mærke i maven",2026-04-13 13:28:00,gambling,False,True,high
46,1,"Hej, er der nogen erfaren spillere der kan hjælpe mig med at forstå wagering krav?",2026-04-13 13:30:00,normal,False,False,none
47,39,"Det her casino har den bedste bonus struktur jeg nogensinde har set, virkelig",2026-04-13 13:32:00,normal,False,False,none
48,37,"tredje gang jeg topper op i dag, burde nok snart stoppe men det er svært når man er så tæt på",2026-04-13 13:34:00,gambling,False,True,low
49,27,"fed session i dag, op med 800 kr på blackjack 🎉",2026-04-13 13:36:00,normal,False,False,none
50,56,Tip: prøv at spille med lavere indsats i starten af sessionen og skru op hvis det går godt,2026-04-13 13:38:00,normal,False,False,none
51,75,"woooow x847 multiplikator, det sker altså ikke tit 😂",2026-04-13 13:40:00,normal,False,False,none
52,78,er support hurtig her hvis man har spørgsmål?,2026-04-13 13:42:00,normal,False,False,none
53,42,Nogen der spiller live dealer? Synes det er meget mere spændende end slots,2026-04-13 13:44:00,both,True,True,medium
54,60,"har brugt hele min løn på forhånd næsten... men whatever, man lever kun en gang",2026-04-13 13:46:00,gambling,False,True,low
55,57,"Hej alle sammen! Første gang jeg er herinde, håber I er søde 😊",2026-04-13 13:48:00,normal,False,False,none
56,57,"live blackjack med 50 kr bordgrænse, perfekt til mig der ikke vil satse for meget",2026-04-13 13:50:00,normal,False,False,none
57,28,"du er den mest hjernedøde bums jeg nogensinde har set spille, gå tilbage til ældrehjemmet din senile idiot",2026-04-13 13:52:00,hate_speech,True,False,high
58,66,Nogen der har prøvet Gonzo's Quest Megaways? Er den god?,2026-04-13 13:54:00,normal,False,False,none
59,61,"indsatte 200 og kørte dem op til 1.100 på crash game, trækker dem nu ud",2026-04-13 13:56:00,normal,False,False,none
60,22,sidder her og ryster lidt. ved ikke rigtig hvad jeg laver mere. har tabt alt hvad jeg havde og sætter stadig ind. nogen der kender til en god strategi,2026-04-13 13:58:00,gambling,False,True,medium
61,11,"tip til roulette: spil altid på europæisk, huset har lavere fordel end amerikansk",2026-04-13 14:00:00,normal,False,False,none
62,37,lånte penge af min bror for at betale husleje men brugte dem her i stedet... han tror stadig jeg har betalt,2026-04-13 14:02:00,gambling,False,True,high
63,66,Kan man stadig få velkomstbonussen hvis man glemte at bruge koden??,2026-04-13 14:04:00,normal,False,False,none
64,80,Velkommen til alle de nye! Husk nu at sætte et depositum limit inden i starter,2026-04-13 14:06:00,normal,False,False,none
65,43,"Haha tabte lige 200 kr på 5 minutter, klassisk mandag morgen",2026-04-13 14:08:00,normal,False,False,none
66,12,ej hvor er det frustrerende at komme så tæt på jackpotten,2026-04-13 14:10:00,normal,False,False,none
67,31,hvorfor fanden giver de her slots aldrig noget? har spillet i 4 timer nu,2026-04-13 14:12:00,gambling,False,True,low
68,40,hej fra aarhus! regner udenfor så perfekt casinovejr hehe,2026-04-13 14:14:00,normal,False,False,none
69,29,"min konto er minus og jeg har brugt kreditkortet, men hvis jeg bare rammer et stort win nu så er det hele okay",2026-04-13 14:16:00,gambling,False,True,high
70,26,"OMG OMG OMG lige landet 3 scatters, nu MÅ der komme noget!!!",2026-04-13 14:18:00,edge_case,,,ambiguous
71,19,"spiller altid med et fast budget, det er den rigtige måde at gøre det på",2026-04-13 14:20:00,normal,False,False,none
72,4,lol casinos er jo bare en skat man betaler frivilligt,2026-04-13 14:22:00,edge_case,,,ambiguous
73,6,"hold kæft din fucking idiot, du har ødelagt mit spil med din lort strategigivning",2026-04-13 14:24:00,hate_speech,True,False,high
74,32,"det giver ingen mening, statistisk set SKAL jeg snart vinde, har tabt 12 gange i træk",2026-04-13 14:26:00,gambling,False,True,medium
75,61,"Spiller kun med bonus penge i dag, tør ikke røre min rigtige konto efter i går lol",2026-04-13 14:28:00,both,True,True,medium
76,79,Er der nogen der ved om der kommer flere live dealer borde? Synes udvalget er lidt småt,2026-04-13 14:30:00,both,True,True,medium
77,10,"spillede starburst i en time, op og ned hele tiden, endte med at miste 150 øre 😅",2026-04-13 14:32:00,normal,False,False,none
78,59,"jeg har tabt 3000 kr på den her time, men jeg kan mærke at mit held er ved at vende, skal bare spille lidt mere",2026-04-13 14:34:00,gambling,False,True,medium
79,54,"okay det er sku nok for i aften, jeg er ved at blive tosset",2026-04-13 14:36:00,hate_speech,True,False,low
80,74,"Fik lige 50 free spins på Book of Dead, fingers crossed!!",2026-04-13 14:38:00,normal,False,False,none
81,25,"Starburst er stadig min favorit, simpel men fed",2026-04-13 14:40:00,normal,False,False,none
82,50,"Mega fed jackpot på Book of Dead lige nu, nogen med?",2026-04-13 14:42:00,normal,False,False,none
83,64,"Roulette er bare random, folk der tror de har et system tager fejl lol",2026-04-13 14:44:00,both,True,True,medium
84,52,"LOL se engang på den her noob haha, komplet håbløs case",2026-04-13 14:46:00,hate_speech,True,False,medium
85,32,har ikke sovet i 2 dage. sidder stadig her. tabte løn for hele måneden men systemet virker nu tror jeg. rød sort rød sort rød. jeg har fundet mønsteret,2026-04-13 14:48:00,gambling,False,True,high
86,19,"Hej alle sammen! Første gang jeg prøver dette casino, ser ret fedt ud 😄",2026-04-13 14:50:00,both,True,True,medium
87,1,"har lovet mig selv at stoppe men jackpotten er på 400.000 kr lige nu, det ville løse alle mine problemer",2026-04-13 14:52:00,gambling,False,True,medium
88,14,god aften alle sammen 👋,2026-04-13 14:54:00,normal,False,False,none
89,55,Nogen der har prøvet den nye slot med vikinger? Den er helt vild!,2026-04-13 14:56:00,both,True,True,medium
90,29,Nogen der har prøvet Starburst? Er den værd at spille?,2026-04-13 14:58:00,normal,False,False,none
91,23,har siddet her i 2 timer og ikke vundet en skid lol,2026-04-13 15:00:00,normal,False,False,none
92,67,"live dealer bordene er så meget bedre end de normale, føles mere ægte",2026-04-13 15:02:00,normal,False,False,none
93,60,I er alle sammen nogle skvat der ikke engang tør spille ordentlige stakes lmaooo,2026-04-13 15:04:00,hate_speech,True,False,medium
94,7,ARGHHH tredje gang jeg rammer bust med 20 i hånden 😡,2026-04-13 15:06:00,hate_speech,True,False,low
95,72,"support er faktisk ret hurtige her, fik svar inden for 5 min",2026-04-13 15:08:00,normal,False,False,none
96,32,nogen der spiller mega moolah? den jackpot er kæmpe stor nu,2026-04-13 15:10:00,normal,False,False,none
97,16,"hej alle sammen! første gang jeg er her, hvad spiller i mest?",2026-04-13 15:12:00,normal,False,False,none
98,59,"Live roulette med den franske dealer er altid god underholdning, hun er sjov 😄",2026-04-13 15:14:00,both,True,True,medium
99,18,har lånt penge af min bror og sagt det var til husleje... føler mig lidt dårlig men det er okay for jeg vinder dem tilbage i aften og betaler ham inden han finder ud af det,2026-04-13 15:16:00,gambling,False,True,high
100,60,Er det bare mig eller er Book of Dead totalt død om mandagen,2026-04-13 15:18:00,normal,False,False,none
101,68,"Ugh seriously, det er tredje gang serveren driller i dag. Kom nu",2026-04-13 15:20:00,hate_speech,True,False,low
102,72,"har siddet her siden kl 9 i morges, er nede med næsten 8000 men jackpotten er ved at ramme jeg kan bare mærke det på spillene",2026-04-13 15:22:00,gambling,False,True,medium
103,77,HA HA HA taber!!! gå hjem og græd til din mor din lille kryster,2026-04-13 15:24:00,hate_speech,True,False,medium
104,41,har siddet her siden klokken 14 og er stadig ikke i plus. spiste ikke aftensmad for at have mere tid til at spille mig fri,2026-04-13 15:26:00,gambling,False,True,medium
105,57,"mega fedt at der er live dealer, føles mere ægte",2026-04-13 15:28:00,normal,False,False,none
106,79,"mine venner spørger hvorfor jeg aldrig har råd til at gå ud mere, jeg siger bare at jeg sparer op",2026-04-13 15:30:00,gambling,False,True,low
107,65,"Udbetaling tog 2 dage sidst, håber det går hurtigere denne gang",2026-04-13 15:32:00,normal,False,False,none
108,55,okay 3. gang jeg indsætter i dag. det her er den sidste gang jeg lover mig selv det. bare rolig. jeg vinder dem tilbage nu,2026-04-13 15:34:00,gambling,False,True,high
109,71,Hvad er jeres favorit slot lige nu? Jeg er ret hooked på Dead or Alive 2,2026-04-13 15:36:00,normal,False,False,none
110,58,"har spillet i 6 timer straight, rygggen er ødelagt men jackpotten kommer nok snart",2026-04-13 15:38:00,gambling,False,True,low
111,21,"Pragmatic Play's Gates of Olympus er min favorit lige nu, vild volatilitet",2026-04-13 15:40:00,normal,False,False,none
112,61,"jeg har lige tabt 15000 på 20 minutter... jeg forstår det ikke, jeg VED at jeg er heldig i dag, jeg kan mærke det. Kan I ikke give mig en bonus så jeg kan vinde det tilbage? Jeg SKAL have de penge tilbage inden min kone kommer hjem",2026-04-13 15:42:00,gambling,False,True,high
113,58,"Crashed ud af bonus runden 1 spin før big win, vil græde 😭",2026-04-13 15:44:00,normal,False,False,none
114,34,"blackjack bordet er altså lækkert her, dealer er hurtig",2026-04-13 15:46:00,normal,False,False,none
115,32,"har spillet i 9 timer nu uden pause, er nede med 4000. begynder at blive lidt desperat ærlig talt",2026-04-13 15:48:00,gambling,False,True,medium
116,36,"første gang jeg prøver casino og jeg er allerede hoppet på igen efter første tab, dette er fint og normalt",2026-04-13 15:50:00,edge_case,,,ambiguous
117,67,Hvad er min bedste strategi mod dealeren? Jeg taber altid på 16,2026-04-13 15:52:00,both,True,True,medium
118,63,"Prøv Gates of Olympus hvis i ikke har, den er faktisk ret fed",2026-04-13 15:54:00,normal,False,False,none
119,31,"tip: sæt altid små beløb på de progressive jackpots, man ved aldrig 😉",2026-04-13 15:56:00,normal,False,False,none
120,36,"kæft en fucking nørd, har du overhovedet venner eller sidder du bare her alene hele dagen??",2026-04-13 15:58:00,hate_speech,True,False,medium
121,57,Hvornår opdaterer de bonushjulet? Venter siden i går,2026-04-13 16:00:00,normal,False,False,none
122,10,"din fucking idiot, hold kæft og forsvind fra chatten",2026-04-13 16:02:00,hate_speech,True,False,high
123,37,"brilliant ide at lave wagering krav på 40x, absolut spiller-venligt design, godt tænkt",2026-04-13 16:04:00,edge_case,,,ambiguous
124,31,"Øv mand, troede da virkelig det her var min aften. Men nej selvfølgelig ikke 😒",2026-04-13 16:06:00,hate_speech,True,False,low
125,35,"hold din kæft med de der tips din spastiker, ingen bad dig om noget",2026-04-13 16:08:00,hate_speech,True,False,medium
126,43,"Fik lige en gevinst på 450 kr på Book of Dead, vildt!!",2026-04-13 16:10:00,both,True,True,medium
127,41,"stop med at eksistere din uduelige stykke lort, alle hader dig",2026-04-13 16:12:00,hate_speech,True,False,high
128,70,RTP på 96% lyder godt men i praksis mærker man det ikke altid 😄,2026-04-13 16:14:00,normal,False,False,none
129,11,"Lige landet en x847 multiplikator på Gates of Olympus, WOOOW",2026-04-13 16:16:00,normal,False,False,none
130,18,det er ikke normalt at tænke på casino hele dagen vel? eller gør i alle det,2026-04-13 16:18:00,gambling,False,True,low
131,20,spiller mest for at koble af fra arbejdet men det gør mig egentlig mere stresset når jeg taber,2026-04-13 16:20:00,gambling,False,True,low
132,30,"Fik lige 500 kr i bonus ved indbetaling, nice",2026-04-13 16:22:00,normal,False,False,none
133,50,"Udbetaling tog kun 1 dag denne gang, fedt",2026-04-13 16:24:00,normal,False,False,none
134,20,tabt 800 men vandt 850 så jeg er egentlig i plus hvis man ser det på den rigtige måde,2026-04-13 16:26:00,edge_case,,,ambiguous
135,28,"fuck dig og fuck dette lort casino, håber du mister alt hvad du ejer din lille taber",2026-04-13 16:28:00,hate_speech,True,False,medium
136,9,hvad spiller i andre?,2026-04-13 16:30:00,normal,False,False,none
137,54,"din dumme ko, prøv at lær reglerne inden du spilder min tid",2026-04-13 16:32:00,hate_speech,True,False,medium
138,53,det er jo ikke et problem jeg hygger mig bare... også selvom jeg taber,2026-04-13 16:34:00,gambling,False,True,low
139,43,hjalp nogen med at finde et site uden indbetalingsgrænser? grænsen her ødelægger min strategi,2026-04-13 16:36:00,gambling,False,True,medium
140,70,HAR NOGEN PRØVET at spille den her med autospin? den opfører sig helt anderledes!!,2026-04-13 16:38:00,edge_case,,,ambiguous
141,60,"Har spillet i 3 timer og er 80 kr i plus, det tager jeg som en sejr haha",2026-04-13 16:40:00,normal,False,False,none
142,54,"Godnat alle, trækker mig med et lille plus, kan man ikke klage over 😄",2026-04-13 16:42:00,both,True,True,medium
143,8,"Hvornår plejer I at spille? Jeg synes altid gevinster er bedre om aftenen, placebo måske hehe",2026-04-13 16:44:00,normal,False,False,none
144,27,"har siddet her i 2 timer og er næsten break even, tager det som en sejr lol",2026-04-13 16:46:00,normal,False,False,none
145,54,Tip til nye spillere: Start altid med demo versionen inden du bruger rigtige penge,2026-04-13 16:48:00,normal,False,False,none
146,50,Live roulette er bare så meget sjovere end den automatiske version,2026-04-13 16:50:00,normal,False,False,none
147,75,"Ramte podium i turneringen!! 3. plads, tager jeg gerne",2026-04-13 16:52:00,both,True,True,medium
148,3,jeg håber virkelig du mister alt og ender på gaden din skrald,2026-04-13 16:54:00,hate_speech,True,False,high
149,74,"kælling, gå tilbage til køkkenet og lad os spille i fred",2026-04-13 16:56:00,hate_speech,True,False,high
150,49,"MIN BEDSTE GEVINST NOGENSINDE, jeg er helt væk!!!",2026-04-13 16:58:00,edge_case,,,ambiguous
151,62,"nå okay, det var åbenbart ikke min aften. for pokker",2026-04-13 17:00:00,hate_speech,True,False,low
152,1,Nogen der kender en god strategi til baccarat? Har aldrig rigtig fattet det spil,2026-04-13 17:02:00,normal,False,False,none
153,46,Bare vundet 2000 på Starburst!! 🎉🎉🎉,2026-04-13 17:04:00,both,True,True,medium
154,39,"næste gang du logger ind, så pas på. vi ved hvem du er",2026-04-13 17:06:00,hate_speech,True,False,high
155,50,lige lavet endnu et indskud. ved godt det er dumt men kan ikke stoppe nu når jeg er så tæt på at break even,2026-04-13 17:08:00,gambling,False,True,medium
156,54,"taber og taber og taber, men altså... det er jo bare sjov",2026-04-13 17:10:00,edge_case,,,ambiguous
157,69,"er bare sur, har tabt hvad der svarer til en halv måneds husleje på en uge",2026-04-13 17:12:00,gambling,False,True,low
158,70,Nogen der kender en god strategi til pai gow poker?,2026-04-13 17:14:00,normal,False,False,none
159,78,Mega frustrerende når man sidder og venter på bonus buy og der sker ingenting,2026-04-13 17:16:00,both,True,True,medium
160,29,"Prøvede tilfældigt Gonzo's Quest og ramte 3000x, er det normalt??",2026-04-13 17:18:00,normal,False,False,none
161,63,Haha jeg vandt 200 kr på roulette ved at sætte på sort hele vejen igennem,2026-04-13 17:20:00,normal,False,False,none
162,29,hvad fanden laver du egentlig? er du fucking retarderet eller hvad?,2026-04-13 17:22:00,hate_speech,True,False,medium
163,35,"håber virkelig du kører hjem og kører ind i et træ ikk, verden er bedre uden dig",2026-04-13 17:24:00,hate_speech,True,False,high
164,56,"fucking autist, ingen vil have dig her, stik af",2026-04-13 17:26:00,hate_speech,True,False,high
165,63,kan nogen fortælle mig hvordan man hæver sin indbetalingsgrænse? har brug for at spille mere i dag,2026-04-13 17:28:00,gambling,False,True,medium
166,4,har siddet her siden i går aftes og stadig ikke ramt noget ordentligt...,2026-04-13 17:30:00,gambling,False,True,low
167,50,"Tak for hyggen allesammen, lukker ned for i aften. GL til jer der fortsætter! 🍀",2026-04-13 17:32:00,normal,False,False,none
168,44,"øv, tabte igen... det er sgu ikke sjovt mere",2026-04-13 17:34:00,hate_speech,True,False,low
169,52,tænker på casino hele dagen på arbejde. kan ikke koncentrere mig om andet. bare venter på at komme hjem og spille,2026-04-13 17:36:00,gambling,False,True,high
170,22,solgte min playstation i dag for at have råd til at spille. det er en investering ikke et problem. folk sælger jo aktier og sådan noget. det her er det samme bare hurtigere,2026-04-13 17:38:00,gambling,False,True,high
171,60,"tip: sæt altid et budget inden du starter, det hjælper mig rigtig meget",2026-04-13 17:40:00,normal,False,False,none
172,17,"det her er simpelthen noget lort, 5 gange i træk sort",2026-04-13 17:42:00,hate_speech,True,False,low
173,80,Nogen der kender til et godt tidspunkt at spille slots? Hørte noget om at det er bedre om natten?,2026-04-13 17:44:00,both,True,True,medium
174,69,"God aften folkens, hvad spiller I i aften?",2026-04-13 17:46:00,normal,False,False,none
175,4,Mega fed dag! Ramte free spins 3 gange i træk på Book of Dead,2026-04-13 17:48:00,normal,False,False,none
176,51,fed gevinst på Book of Dead lige nu 😄,2026-04-13 17:50:00,normal,False,False,none
177,76,"dit liv er ingenting værd, gør verden en tjeneste og forsvind",2026-04-13 17:52:00,hate_speech,True,False,high
178,73,"tabte 50kr og stoppede, det er min grænse for i dag. disciplin er vigtigt!",2026-04-13 17:54:00,normal,False,False,none
179,4,jeg hader mig selv for det her men jeg kan stadig ikke stoppe. har prøvet så mange gange. ingen ved det,2026-04-13 17:56:00,gambling,False,True,high
180,11,"okay én runde mere og så stopper jeg, det lover jeg mig selv haha",2026-04-13 17:58:00,edge_case,,,ambiguous
181,55,"din klamme lille fyr, gå væk fra bordet og kom aldrig tilbage",2026-04-13 18:00:00,hate_speech,True,False,medium
182,18,"book of dead er stadig min favorit, intet slår den klassiker",2026-04-13 18:02:00,normal,False,False,none
183,60,"for søren da, lige nu hader jeg dette spil",2026-04-13 18:04:00,hate_speech,True,False,low
184,24,"nå men det var så det, ses igen om 5 min hahaha",2026-04-13 18:06:00,edge_case,,,ambiguous
185,7,"Tabte alt min bonus på 10 minutter, det var hurtigt gået 😂 nå, det var bare bonus penge",2026-04-13 18:08:00,both,True,True,medium
186,34,Nogen der kender en god strategi til baccarat eller er det bare held?,2026-04-13 18:10:00,normal,False,False,none
187,49,"tak for tips med slots typen, virkede faktisk!",2026-04-13 18:12:00,normal,False,False,none
188,42,OMG OMG OMG lige ramt 500kr på gates!!! nu kører vi!!,2026-04-13 18:14:00,edge_case,,,ambiguous
189,28,"fik min udbetaling på 2 dage, ret hurtigt 👍",2026-04-13 18:16:00,normal,False,False,none
190,59,har nogen testet dead or alive 2? hørte det er ret sjov,2026-04-13 18:18:00,normal,False,False,none
191,42,min kone tror jeg er ude med vennerne men jeg sidder her og forsøger at vinde vores husleje tilbage,2026-04-13 18:20:00,gambling,False,True,medium
192,44,"vi ved dit rigtige navn. fortsæt bare, det går ikke godt for dig",2026-04-13 18:22:00,hate_speech,True,False,high
193,49,jeg sover dårligt når jeg ikke har fået spillet lidt inden sengetid,2026-04-13 18:24:00,gambling,False,True,low
194,36,"haha 5 kr gevinst på en 50 kr spin, tak skal du ha' 👍",2026-04-13 18:26:00,edge_case,,,ambiguous
195,54,har de ikke Aviator her? kan ikke finde det i lobbyen,2026-04-13 18:28:00,normal,False,False,none
196,33,jeg håber virkelig du mister din lejlighed over det her din spilafhængige idiot,2026-04-13 18:30:00,hate_speech,True,False,medium
197,11,"Lige taget en pause og spist aftensmad, nu er jeg klar igen haha",2026-04-13 18:32:00,normal,False,False,none
198,61,Tillykke til @mikkel83 med gevinsten! Fortjent fyr 👏,2026-04-13 18:34:00,normal,False,False,none
199,3,"volatilitet er vigtig at forstå når man vælger slot, high vol = sjældnere men større gevinster",2026-04-13 18:36:00,normal,False,False,none
200,70,Hvad pokker er der sket med min favorit slot? Den er forsvundet fra siden???,2026-04-13 18:38:00,both,True,True,medium
201,7,"din mor burde have smidt dig ud, seriøst det er pinligt at se på dig spille din jævla noob",2026-04-13 18:40:00,hate_speech,True,False,medium
202,45,"jeg håber virkelig dit liv er ligeså elendigt som dit spil, taber",2026-04-13 18:42:00,hate_speech,True,False,medium
203,29,nogen der kender et sted hvor man kan få et hurtigt lån? banken vil ikke mere,2026-04-13 18:44:00,gambling,False,True,high
