msg_id,user_id,content,timestamp,label,hate_speech,gambling,severity
409,31,"pragmatic play laver virkelig gode slots, lightning roulette er også sjov",2026-04-14 01:36:00,normal,False,False,none
410,23,"lige ramt bonusrunden på Starburst, fingre krydsede 🤞",2026-04-14 01:38:00,normal,False,False,none
411,71,er der nogen der ved hvornår de nye kampagner kommer? plejer det ikke at være om fredagen,2026-04-14 01:40:00,normal,False,False,none
412,10,har siddet her siden kl 14 og det er snart midnat... tid flyver når man hygger sig haha,2026-04-14 01:42:00,gambling,False,True,low
413,21,"Jamen helvede til, nu røg forbindelsen igen mens jeg var midt i en runde",2026-04-14 01:44:00,hate_speech,True,False,low
414,1,jamen selvfølgelig stopper bonussen præcis der... klassisk,2026-04-14 01:46:00,edge_case,,,ambiguous
415,53,"Prøvede poker for første gang, fik tæsk men lærte en del haha",2026-04-14 01:48:00,both,True,True,medium
416,58,"Lige smadret en bonus på Starburst, 200kr ind og 1400 ud haha",2026-04-14 01:50:00,normal,False,False,none
417,77,"support er virkelig hurtige her, ventede kun 45 minutter på svar, topklasse service altså",2026-04-14 01:52:00,edge_case,,,ambiguous
418,61,Sweet Bonanza er ren hjertemedicin når den starter bonusrunden 😍,2026-04-14 01:54:00,both,True,True,medium
419,38,"Sweet Bonanza er mit guilty pleasure, den er så farverig og sjov 🍭",2026-04-14 01:56:00,normal,False,False,none
420,5,HVORFOR GØR SLOTS DET HER??? jeg var SÅ TÆT PÅ jackpotten 4 gange i træk det er umuligt at det bare er tilfældigt de snyder mig med vilje. Indsætter igen og beviser det,2026-04-14 01:58:00,gambling,False,True,high
421,30,"ramte bonus runden på Big Bass Bonanza 4 gange i træk, vanvittigt!!",2026-04-14 02:00:00,normal,False,False,none
422,37,har sat 5000 ind i dag og er nede på 200 kr. nogen der ved om der er et trick til at vinde på roulette?,2026-04-14 02:02:00,gambling,False,True,medium
423,37,"Åhhh kom nu scatter, jeg har ventet i 40 spin nu 😩",2026-04-14 02:04:00,normal,False,False,none
424,59,Jeg prøver altid at spille for sjov lidt først inden jeg satser rigtige penge,2026-04-14 02:06:00,normal,False,False,none
425,10,HVAD FANDEN. mistet hele min løn på 2 timer. sætter bare 500 mere ind så vinder jeg dem tilbage det plejer at virke,2026-04-14 02:08:00,gambling,False,True,medium
426,30,"haha min kone tror jeg ser tv, men jeg sidder her og spiller 😅",2026-04-14 02:10:00,normal,False,False,none
427,34,LUUK DIG VÆCK FRA BORDENE DIN SPASTIKER INGEN VIL HA DIG HER,2026-04-14 02:12:00,hate_speech,True,False,high
428,76,"mega irriterende når free spins giver nul, sket tre gange i træk nu",2026-04-14 02:14:00,normal,False,False,none
429,26,hvornår har man egentlig spillet for meget? spørger for en ven 😅,2026-04-14 02:16:00,gambling,False,True,low
430,55,har lånt 1000 af min bror til mad men brugte dem her... han ved det ikke,2026-04-14 02:18:00,gambling,False,True,low
431,15,God aften alle! Hvad spiller i på en fredag aften? Jeg starter med lidt live poker,2026-04-14 02:20:00,both,True,True,medium
432,70,Nogen der har prøvet den nye slot de har lagt op? Ragnarok noget?,2026-04-14 02:22:00,normal,False,False,none
433,29,"din hjerne er ligeså lille som din pik, total spildplads",2026-04-14 02:24:00,hate_speech,True,False,high
434,20,Nogen der sidder oppe sent og spiller? 😴 kan ikke sove,2026-04-14 02:26:00,normal,False,False,none
435,35,"god morgen! tidlig session inden arbejde, forhåbentlig er lykken med mig",2026-04-14 02:28:00,normal,False,False,none
436,19,Tip til begyndere: start ALTID med demo versionen inden du spiller for rigtige penge,2026-04-14 02:30:00,normal,False,False,none
437,10,"prøv bare at skriv mere i chatten, jeg skal nok ødelægge dit liv",2026-04-14 02:32:00,hate_speech,True,False,high
438,8,"din idiot, selvfølgelig taber du når du spiller sådan her!!",2026-04-14 02:34:00,hate_speech,True,False,medium
439,22,nogen der kan låne mig 1000 kr? betaler tilbage i morgen når jeg har vundet det hjem,2026-04-14 02:36:00,gambling,False,True,high
440,40,"Ny her, er der forskel på RTP i turbomode eller bare mig?",2026-04-14 02:38:00,normal,False,False,none
441,77,Hvem vinder i aften? Spiller på Danmark naturligvis 🇩🇰,2026-04-14 02:40:00,both,True,True,medium
442,73,"Sidder og hygger med et glas vin og lidt slots, perfekt fredag aften",2026-04-14 02:42:00,normal,False,False,none
443,37,har prøvet 7 forskellige slots i dag og de giver alle sammen ingenting,2026-04-14 02:44:00,gambling,False,True,low
444,57,nogen der har prøvet den nye spillemaskine? den med aztec tema,2026-04-14 02:46:00,normal,False,False,none
445,16,Cashout tager lidt lang tid i dag eller er det bare mig?,2026-04-14 02:48:00,both,True,True,medium
446,60,hvad er jeres go-to strategi på blackjack? jeg bruger altid basic strategy kortet,2026-04-14 02:50:00,normal,False,False,none
447,39,"Husk nu at tage pauser folk, det er bare et spil 🙂",2026-04-14 02:52:00,normal,False,False,none
448,52,"lige hævet mine gevinster, tog kun en dag, det er jeg tilfreds med",2026-04-14 02:54:00,normal,False,False,none
449,35,"haha klassisk, ramte bonus på 20 kr spin og får 40 kr ud, føler mig som millionær 🤑",2026-04-14 02:56:00,edge_case,,,ambiguous
450,65,"I LIVE!!! ramte free spins og det gav ingenting, men selve følelsen mand 😭😭",2026-04-14 02:58:00,edge_case,,,ambiguous
451,70,Sweet Bonanza eller Starlight Princess? Hvad foretrækker folk?,2026-04-14 03:00:00,normal,False,False,none
452,64,okay systemet virker denne gang. rød rød sort rød. har regnet det ud. sætter 3000 på,2026-04-14 03:02:00,gambling,False,True,high
453,57,er der nogen der ved hvornår de har live casino åbent med dansk dealer?,2026-04-14 03:04:00,normal,False,False,none
454,11,"1500kr gevinst på roulette, nu er jeg glad igen haha",2026-04-14 03:06:00,normal,False,False,none
455,77,"okay men den der free spins runde var faktisk virkelig fed, gider ikke at den er slut",2026-04-14 03:08:00,edge_case,,,ambiguous
456,6,"Okay jeg stopper nu, er oppe med 200 kr og vil ikke miste det igen som sidst 😅",2026-04-14 03:10:00,normal,False,False,none
457,56,woop woop 2000kr gevinst!! nu sætter jeg det hele ind igen for at se om lykken holder 🎰,2026-04-14 03:12:00,edge_case,,,ambiguous
458,42,"tog et kviklån for at kunne fortsætte, renten er høj men det er okay når jeg vinder det hjem igen om lidt",2026-04-14 03:14:00,gambling,False,True,medium
459,78,"hold da op den bonus var nice, 200 free spins!!",2026-04-14 03:16:00,normal,False,False,none
460,33,"Supporten var super hjælpsomme da jeg havde problemer med min indbetaling, thumbs up 👍",2026-04-14 03:18:00,both,True,True,medium
461,4,har tabt så mange penge at jeg ikke kan se tallene mere. de betyder ingenting. sætter 5000 ind igen,2026-04-14 03:20:00,gambling,False,True,high
462,12,Blackjack bordet er fuldt igen... typisk,2026-04-14 03:22:00,normal,False,False,none
463,30,Nogen der ved hvornår turneringen starter? Glæder mig,2026-04-14 03:24:00,both,True,True,medium
464,74,"Poker turneringen starter om 20 min, er der nogen der er med?",2026-04-14 03:26:00,both,True,True,medium
465,76,Dead or Alive 2 er stadig KONGEN af alle slots efter min mening 🤠,2026-04-14 03:28:00,normal,False,False,none
466,3,"okay det er tredje gang jeg topper op i dag, nu MÅ det snart vende",2026-04-14 03:30:00,gambling,False,True,low
467,35,"Hvad pokker er der galt med systemet, spillet frøs midt i en fri spin",2026-04-14 03:32:00,hate_speech,True,False,low
468,74,"Book of Dead er stadig min absolute favorit, ingen tvivl",2026-04-14 03:34:00,normal,False,False,none
469,6,"hvad helvede, min bet blev annulleret midt i spillet??",2026-04-14 03:36:00,hate_speech,True,False,low
470,23,"har ikke sovet endnu men det er okay for jeg er på vej op, altid mørkest inden daggry ik",2026-04-14 03:38:00,edge_case,,,ambiguous
471,61,"jeg er nede med 4000 kr men jeg kan mærke at det vender snart, spinner bare 100 mere",2026-04-14 03:40:00,gambling,False,True,medium
472,67,"kan ikke sove alligevel så hvorfor ikke spille lidt, det er jo ikke som om jeg har noget bedre at lave",2026-04-14 03:42:00,gambling,False,True,low
473,57,er det normalt at miste 12.000 på en aften?? føler spillet er rigget men prøver lige med 500 mere for at teste det,2026-04-14 03:44:00,gambling,False,True,medium
474,36,Starburst er bare klassikeren man altid vender tilbage til,2026-04-14 03:46:00,normal,False,False,none
475,24,din mor er en billig ludder og det er du nok også,2026-04-14 03:48:00,hate_speech,True,False,high
476,75,"Prøv Gates of Olympus, den giver virkelig meget i bonus buy",2026-04-14 03:50:00,normal,False,False,none
477,56,fuck jeg hader dette spil men jeg bliver ved alligevel,2026-04-14 03:52:00,gambling,False,True,low
478,63,"fandeme også til dig og din amatøragtige spillestil, hold dig til børnespil din tøs",2026-04-14 03:54:00,hate_speech,True,False,medium
479,12,"poker turnering starter om 20 min, er der nogen der hopper med?",2026-04-14 03:56:00,normal,False,False,none
480,61,har spillet her i 2 år og synes kundeservice er top notch,2026-04-14 03:58:00,normal,False,False,none
481,45,"Spiller altid med ørepropper i og musik, hygger mig bare alene derhjemme",2026-04-14 04:00:00,normal,False,False,none
482,53,"Har spillet her i 2 år, aldrig haft problemer med udbetaling",2026-04-14 04:02:00,normal,False,False,none
483,43,Rammer aldrig den forbandede scatter 😤,2026-04-14 04:04:00,normal,False,False,none
484,42,"det gi'r sgu ingen mening, har tabt 10 gange i streg nu",2026-04-14 04:06:00,hate_speech,True,False,low
485,14,jeg er sgu begyndt at drømme om spillene om natten lol,2026-04-14 04:08:00,gambling,False,True,low
486,21,"Bonusrunden på Dead or Alive 2 er den bedste i branchen, punkt.",2026-04-14 04:10:00,normal,False,False,none
487,43,"din taber, har du ingen venner eller? ret åbenlyst at du sidder alene",2026-04-14 04:12:00,hate_speech,True,False,high
488,53,er det bare mig eller er det her slot simpelthen RIGGED,2026-04-14 04:14:00,edge_case,,,ambiguous
489,64,"det er jo ikke gambling hvis man ved hvad man laver, og jeg ved hvad jeg laver, næsten",2026-04-14 04:16:00,edge_case,,,ambiguous
490,37,brugte min overtidsløn på det her i weekenden. nu er den væk. prøver at vinde den igen inden mandag,2026-04-14 04:18:00,gambling,False,True,medium
491,52,Hvad er jeres favorit slot lige nu? Jeg er total hængt op på Sweet Bonanza,2026-04-14 04:20:00,normal,False,False,none
492,71,kan ikke lade være. prøver at lukke siden men åbner den igen 2 min efter. hvad er der galt med mig,2026-04-14 04:22:00,gambling,False,True,high
493,5,Er det bare mig eller er Pragmatic Play virkelig blevet bedre det seneste år,2026-04-14 04:24:00,normal,False,False,none
494,59,live roulette er bare en anden oplevelse end den normale,2026-04-14 04:26:00,normal,False,False,none
495,12,"Hej allesammen! Første gang jeg er herinde, håber I er søde 😄",2026-04-14 04:28:00,normal,False,False,none
496,41,"Prøvede pragmatic play turneringen i weekenden, kom på en 12. plads, ikke dårligt",2026-04-14 04:30:00,normal,False,False,none
497,33,COME ON COME ON COME ON... nej. FUCKING NEJ. okay en gang til,2026-04-14 04:32:00,gambling,False,True,high
498,42,"Wtf lige mistet alt på et spin, det gør ondt mand",2026-04-14 04:34:00,normal,False,False,none
499,15,"Prøv Gates of Olympus folk, den betaler SÅ godt lige nu ikke til at tro",2026-04-14 04:36:00,normal,False,False,none
500,52,seriøst hvorfor taber man altid mest når man prøver at vinde det tilbage... irriterende,2026-04-14 04:38:00,gambling,False,True,low
